{
  "id": "syn-09-brand-developer-editor",
  "source": "synthetic",
  "request": "品牌形象站，内容很少变，改动找开发同事提交就行。",
  "brief": {
    "schemaVersion": 1,
    "name": "品牌形象站",
    "request": "品牌形象站，内容很少变，改动找开发同事提交就行。",
    "operations": {
      "technicalTeam": false,
      "maintenanceOwner": "客户运营"
    },
    "goals": [
      "brand"
    ],
    "languages": [
      "zh-CN"
    ],
    "features": {
      "contentEditor": "developer"
    }
  },
  "expected": {
    "route": "static-owned",
    "acceptableAlternatives": [],
    "mustAsk": [],
    "mustConflict": [],
    "mustHaveCapabilities": [
      "static-site",
      "source-editing"
    ]
  },
  "rationale": "场景：品牌官网。内容低频且有开发者维护，静态站成本最低。【合成草稿，待业务专家复核】",
  "labeledBy": "synthetic-draft",
  "labeledAt": "2026-10-27"
}
